[
  {
    "id": "5482feef-49a2-4f3a-bf9c-d62b38a686c1",
    "label": "Network spine",
    "chassis_id": "55-C7-28-26-A2-48",
    "mgmt_ip": "10.10.16.16",
    "interfaces": [
      {
        "port_id": "Ethernet 1/1",
        "admin_status": "up",
        "oper_status": "up",
        "speed": "1Gbit/s",
        "mtu": 1500
      },
      {
        "port_id": "Ethernet 1/2",
        "admin_status": "up",
        "oper_status": "up",
        "speed": "100Gbit/s"
      },
      {
        "port_id": "Ethernet 1/3",
        "admin_status": "up",
        "oper_status": "up",
        "speed": "100Gbit/s"
      }
    ]
  },
  {
    "id": "4b6452a8-6132-40e9-a8c3-aa0576e791f6",
    "label": "Network leaf 1",
    "chassis_id": "3A-4A-F9-30-14-61",
    "mgmt_ip": "10.10.18.18",
    "interfaces": [
      {
        "port_id": "Ethernet 1/1",
        "admin_status": "up",
        "oper_status": "up",
        "speed": "1Gbit/s",
        "mtu": 1800
      },
      {
        "port_id": "Ethernet 1/2",
        "admin_status": "up",
        "oper_status": "up",
        "speed": "10Gbit/s"
      },
      {
        "port_id": "Ethernet 1/3",
        "admin_status": "up",
        "oper_status": "up",
        "speed": "10Gbit/s"
      }
    ]
  },
  {
    "id": "035a3ee6-1588-4ed3-a081-0a18539ad7d9",
    "label": "Network leaf 2",
    "chassis_id": "52-43-91-DF-0F-26",
    "mgmt_ip": "10.10.24.20",
    "interfaces": [
      {
        "port_id": "Ethernet 1/1",
        "admin_status": "up",
        "oper_status": "up",
        "speed": "1Gbit/s",
        "mtu": 1800
      },
      {
        "port_id": "Ethernet 1/2",
        "admin_status": "up",
        "oper_status": "up",
        "speed": "10Gbit/s"
      },
      {
        "port_id": "Ethernet 1/3",
        "admin_status": "up",
        "oper_status": "up",
        "speed": "10Gbit/s"
      }
    ]
  }
]
